No.     Time           Source                Destination           Protocol Length Info
      1 0.000000       10.0.5.91             142.251.220.99        TCP      55     26840 → 443 [ACK] Seq=1 Ack=1 Win=256 Len=1

Frame 1: 55 bytes on wire (440 bits), 55 bytes captured (440 bits) on interface \Device\NPF_{84FAA220-1E48-4D46-9042-3D107EF88B2B}, id 0
Ethernet II, Src: Intel_df:95:53 (58:fb:84:df:95:53), Dst: Sophos_d1:43:e0 (7c:5a:1c:d1:43:e0)
Internet Protocol Version 4, Src: 10.0.5.91, Dst: 142.251.220.99
Transmission Control Protocol, Src Port: 26840, Dst Port: 443, Seq: 1, Ack: 1, Len: 1
    Source Port: 26840
    Destination Port: 443
    [Stream index: 0]
    [Stream Packet Number: 1]
    [Conversation completeness: Incomplete (28)]
    [TCP Segment Len: 1]
    Sequence Number: 1    (relative sequence number)
    Sequence Number (raw): 3322720961
    [Next Sequence Number: 2    (relative sequence number)]
    Acknowledgment Number: 1    (relative ack number)
    Acknowledgment number (raw): 3647195261
    0101 .... = Header Length: 20 bytes (5)
    Flags: 0x010 (ACK)
    Window: 256
    [Calculated window size: 256]
    [Window size scaling factor: -1 (unknown)]
    Checksum: 0xaed6 [unverified]
    [Checksum Status: Unverified]
    Urgent Pointer: 0
    [Timestamps]
    [SEQ/ACK analysis]
    TCP payload (1 byte)
    TCP segment data (1 byte)

No.     Time           Source                Destination           Protocol Length Info
      2 0.018594       142.251.220.99        10.0.5.91             TCP      70     443 → 26840 [ACK] Seq=1 Ack=2 Win=1043 Len=0 SLE=1 SRE=2

Frame 2: 70 bytes on wire (560 bits), 70 bytes captured (560 bits) on interface \Device\NPF_{84FAA220-1E48-4D46-9042-3D107EF88B2B}, id 0
Ethernet II, Src: Sophos_d1:43:e0 (7c:5a:1c:d1:43:e0), Dst: Intel_df:95:53 (58:fb:84:df:95:53)
802.1Q Virtual LAN, PRI: 0, DEI: 0, ID: 0
Internet Protocol Version 4, Src: 142.251.220.99, Dst: 10.0.5.91
Transmission Control Protocol, Src Port: 443, Dst Port: 26840, Seq: 1, Ack: 2, Len: 0
    Source Port: 443
    Destination Port: 26840
    [Stream index: 0]
    [Stream Packet Number: 2]
    [Conversation completeness: Incomplete (28)]
    [TCP Segment Len: 0]
    Sequence Number: 1    (relative sequence number)
    Sequence Number (raw): 3647195261
    [Next Sequence Number: 1    (relative sequence number)]
    Acknowledgment Number: 2    (relative ack number)
    Acknowledgment number (raw): 3322720962
    1000 .... = Header Length: 32 bytes (8)
    Flags: 0x010 (ACK)
    Window: 1043
    [Calculated window size: 1043]
    [Window size scaling factor: -1 (unknown)]
    Checksum: 0x840e [unverified]
    [Checksum Status: Unverified]
    Urgent Pointer: 0
    Options: (12 bytes), No-Operation (NOP), No-Operation (NOP), SACK
    [Timestamps]
    [SEQ/ACK analysis]

No.     Time           Source                Destination           Protocol Length Info
      3 0.020352       10.0.5.91             1.1.1.1               DNS      92     Standard query 0xa9d5 A extension.femetrics.grammarly.io

Frame 3: 92 bytes on wire (736 bits), 92 bytes captured (736 bits) on interface \Device\NPF_{84FAA220-1E48-4D46-9042-3D107EF88B2B}, id 0
Ethernet II, Src: Intel_df:95:53 (58:fb:84:df:95:53), Dst: Sophos_d1:43:e0 (7c:5a:1c:d1:43:e0)
Internet Protocol Version 4, Src: 10.0.5.91, Dst: 1.1.1.1
User Datagram Protocol, Src Port: 63617, Dst Port: 53
Domain Name System (query)

No.     Time           Source                Destination           Protocol Length Info
      4 0.020973       10.0.5.91             1.1.1.1               DNS      92     Standard query 0xa104 HTTPS extension.femetrics.grammarly.io

Frame 4: 92 bytes on wire (736 bits), 92 bytes captured (736 bits) on interface \Device\NPF_{84FAA220-1E48-4D46-9042-3D107EF88B2B}, id 0
Ethernet II, Src: Intel_df:95:53 (58:fb:84:df:95:53), Dst: Sophos_d1:43:e0 (7c:5a:1c:d1:43:e0)
Internet Protocol Version 4, Src: 10.0.5.91, Dst: 1.1.1.1
User Datagram Protocol, Src Port: 50395, Dst Port: 53
Domain Name System (query)

No.     Time           Source                Destination           Protocol Length Info
      5 0.034903       1.1.1.1               10.0.5.91             DNS      220    Standard query response 0xa9d5 A extension.femetrics.grammarly.io A 54.158.59.106 A 100.29.149.0 A 34.227.146.139 A 13.223.118.82 A 3.214.228.214 A 52.203.238.238 A 52.86.232.158 A 52.54.178.252

Frame 5: 220 bytes on wire (1760 bits), 220 bytes captured (1760 bits) on interface \Device\NPF_{84FAA220-1E48-4D46-9042-3D107EF88B2B}, id 0
Ethernet II, Src: Sophos_d1:43:e0 (7c:5a:1c:d1:43:e0), Dst: Intel_df:95:53 (58:fb:84:df:95:53)
Internet Protocol Version 4, Src: 1.1.1.1, Dst: 10.0.5.91
User Datagram Protocol, Src Port: 53, Dst Port: 63617
Domain Name System (response)

No.     Time           Source                Destination           Protocol Length Info
      6 0.040908       1.1.1.1               10.0.5.91             DNS      183    Standard query response 0xa104 HTTPS extension.femetrics.grammarly.io SOA ns-1688.awsdns-19.co.uk

Frame 6: 183 bytes on wire (1464 bits), 183 bytes captured (1464 bits) on interface \Device\NPF_{84FAA220-1E48-4D46-9042-3D107EF88B2B}, id 0
Ethernet II, Src: Sophos_d1:43:e0 (7c:5a:1c:d1:43:e0), Dst: Intel_df:95:53 (58:fb:84:df:95:53)
802.1Q Virtual LAN, PRI: 0, DEI: 0, ID: 0
Internet Protocol Version 4, Src: 1.1.1.1, Dst: 10.0.5.91
User Datagram Protocol, Src Port: 53, Dst Port: 50395
Domain Name System (response)

No.     Time           Source                Destination           Protocol Length Info
      7 0.042073       10.0.5.91             142.251.220.99        TCP      54     44668 → 443 [FIN, ACK] Seq=1 Ack=1 Win=255 Len=0

Frame 7: 54 bytes on wire (432 bits), 54 bytes captured (432 bits) on interface \Device\NPF_{84FAA220-1E48-4D46-9042-3D107EF88B2B}, id 0
Ethernet II, Src: Intel_df:95:53 (58:fb:84:df:95:53), Dst: Sophos_d1:43:e0 (7c:5a:1c:d1:43:e0)
Internet Protocol Version 4, Src: 10.0.5.91, Dst: 142.251.220.99
Transmission Control Protocol, Src Port: 44668, Dst Port: 443, Seq: 1, Ack: 1, Len: 0
    Source Port: 44668
    Destination Port: 443
    [Stream index: 1]
    [Stream Packet Number: 1]
    [Conversation completeness: Incomplete (20)]
    [TCP Segment Len: 0]
    Sequence Number: 1    (relative sequence number)
    Sequence Number (raw): 3844770763
    [Next Sequence Number: 2    (relative sequence number)]
    Acknowledgment Number: 1    (relative ack number)
    Acknowledgment number (raw): 1500391096
    0101 .... = Header Length: 20 bytes (5)
    Flags: 0x011 (FIN, ACK)
    Window: 255
    [Calculated window size: 255]
    [Window size scaling factor: -1 (unknown)]
    Checksum: 0x92c6 [unverified]
    [Checksum Status: Unverified]
    Urgent Pointer: 0
    [Timestamps]

No.     Time           Source                Destination           Protocol Length Info
      8 0.042435       10.0.5.91             142.250.77.99         TCP      54     14553 → 443 [FIN, ACK] Seq=1 Ack=1 Win=255 Len=0

Frame 8: 54 bytes on wire (432 bits), 54 bytes captured (432 bits) on interface \Device\NPF_{84FAA220-1E48-4D46-9042-3D107EF88B2B}, id 0
Ethernet II, Src: Intel_df:95:53 (58:fb:84:df:95:53), Dst: Sophos_d1:43:e0 (7c:5a:1c:d1:43:e0)
Internet Protocol Version 4, Src: 10.0.5.91, Dst: 142.250.77.99
Transmission Control Protocol, Src Port: 14553, Dst Port: 443, Seq: 1, Ack: 1, Len: 0
    Source Port: 14553
    Destination Port: 443
    [Stream index: 2]
    [Stream Packet Number: 1]
    [Conversation completeness: Incomplete (20)]
    [TCP Segment Len: 0]
    Sequence Number: 1    (relative sequence number)
    Sequence Number (raw): 3030388660
    [Next Sequence Number: 2    (relative sequence number)]
    Acknowledgment Number: 1    (relative ack number)
    Acknowledgment number (raw): 204321992
    0101 .... = Header Length: 20 bytes (5)
    Flags: 0x011 (FIN, ACK)
    Window: 255
    [Calculated window size: 255]
    [Window size scaling factor: -1 (unknown)]
    Checksum: 0x033e [unverified]
    [Checksum Status: Unverified]
    Urgent Pointer: 0
    [Timestamps]

No.     Time           Source                Destination           Protocol Length Info
      9 0.043315       10.0.5.91             54.158.59.106         TCP      66     9835 → 443 [SYN] Seq=0 Win=64240 Len=0 MSS=1460 WS=256 SACK_PERM

Frame 9: 66 bytes on wire (528 bits), 66 bytes captured (528 bits) on interface \Device\NPF_{84FAA220-1E48-4D46-9042-3D107EF88B2B}, id 0
Ethernet II, Src: Intel_df:95:53 (58:fb:84:df:95:53), Dst: Sophos_d1:43:e0 (7c:5a:1c:d1:43:e0)
Internet Protocol Version 4, Src: 10.0.5.91, Dst: 54.158.59.106
Transmission Control Protocol, Src Port: 9835, Dst Port: 443, Seq: 0, Len: 0
    Source Port: 9835
    Destination Port: 443
    [Stream index: 3]
    [Stream Packet Number: 1]
    [Conversation completeness: Complete, WITH_DATA (31)]
    [TCP Segment Len: 0]
    Sequence Number: 0    (relative sequence number)
    Sequence Number (raw): 3500902261
    [Next Sequence Number: 1    (relative sequence number)]
    Acknowledgment Number: 0
    Acknowledgment number (raw): 0
    1000 .... = Header Length: 32 bytes (8)
    Flags: 0x002 (SYN)
    Window: 64240
    [Calculated window size: 64240]
    Checksum: 0x7275 [unverified]
    [Checksum Status: Unverified]
    Urgent Pointer: 0
    Options: (12 bytes), Maximum segment size, No-Operation (NOP), Window scale, No-Operation (NOP), No-Operation (NOP), SACK permitted
    [Timestamps]

No.     Time           Source                Destination           Protocol Length Info
     10 0.060332       142.250.77.99         10.0.5.91             TCP      60     443 → 14553 [FIN, ACK] Seq=1 Ack=2 Win=1045 Len=0

Frame 10: 60 bytes on wire (480 bits), 60 bytes captured (480 bits) on interface \Device\NPF_{84FAA220-1E48-4D46-9042-3D107EF88B2B}, id 0
Ethernet II, Src: Sophos_d1:43:e0 (7c:5a:1c:d1:43:e0), Dst: Intel_df:95:53 (58:fb:84:df:95:53)
802.1Q Virtual LAN, PRI: 0, DEI: 0, ID: 0
Internet Protocol Version 4, Src: 142.250.77.99, Dst: 10.0.5.91
Transmission Control Protocol, Src Port: 443, Dst Port: 14553, Seq: 1, Ack: 2, Len: 0
    Source Port: 443
    Destination Port: 14553
    [Stream index: 2]
    [Stream Packet Number: 2]
    [Conversation completeness: Incomplete (20)]
    [TCP Segment Len: 0]
    Sequence Number: 1    (relative sequence number)
    Sequence Number (raw): 204321992
    [Next Sequence Number: 2    (relative sequence number)]
    Acknowledgment Number: 2    (relative ack number)
    Acknowledgment number (raw): 3030388661
    0101 .... = Header Length: 20 bytes (5)
    Flags: 0x011 (FIN, ACK)
    Window: 1045
    [Calculated window size: 1045]
    [Window size scaling factor: -1 (unknown)]
    Checksum: 0x0027 [unverified]
    [Checksum Status: Unverified]
    Urgent Pointer: 0
    [Timestamps]
    [SEQ/ACK analysis]

No.     Time           Source                Destination           Protocol Length Info
     11 0.060332       142.251.220.99        10.0.5.91             TCP      60     443 → 44668 [FIN, ACK] Seq=1 Ack=2 Win=1045 Len=0

Frame 11: 60 bytes on wire (480 bits), 60 bytes captured (480 bits) on interface \Device\NPF_{84FAA220-1E48-4D46-9042-3D107EF88B2B}, id 0
Ethernet II, Src: Sophos_d1:43:e0 (7c:5a:1c:d1:43:e0), Dst: Intel_df:95:53 (58:fb:84:df:95:53)
802.1Q Virtual LAN, PRI: 0, DEI: 0, ID: 0
Internet Protocol Version 4, Src: 142.251.220.99, Dst: 10.0.5.91
Transmission Control Protocol, Src Port: 443, Dst Port: 44668, Seq: 1, Ack: 2, Len: 0
    Source Port: 443
    Destination Port: 44668
    [Stream index: 1]
    [Stream Packet Number: 2]
    [Conversation completeness: Incomplete (20)]
    [TCP Segment Len: 0]
    Sequence Number: 1    (relative sequence number)
    Sequence Number (raw): 1500391096
    [Next Sequence Number: 2    (relative sequence number)]
    Acknowledgment Number: 2    (relative ack number)
    Acknowledgment number (raw): 3844770764
    0101 .... = Header Length: 20 bytes (5)
    Flags: 0x011 (FIN, ACK)
    Window: 1045
    [Calculated window size: 1045]
    [Window size scaling factor: -1 (unknown)]
    Checksum: 0x8faf [unverified]
    [Checksum Status: Unverified]
    Urgent Pointer: 0
    [Timestamps]
    [SEQ/ACK analysis]

No.     Time           Source                Destination           Protocol Length Info
     12 0.060456       10.0.5.91             142.250.77.99         TCP      54     14553 → 443 [ACK] Seq=2 Ack=2 Win=255 Len=0

Frame 12: 54 bytes on wire (432 bits), 54 bytes captured (432 bits) on interface \Device\NPF_{84FAA220-1E48-4D46-9042-3D107EF88B2B}, id 0
Ethernet II, Src: Intel_df:95:53 (58:fb:84:df:95:53), Dst: Sophos_d1:43:e0 (7c:5a:1c:d1:43:e0)
Internet Protocol Version 4, Src: 10.0.5.91, Dst: 142.250.77.99
Transmission Control Protocol, Src Port: 14553, Dst Port: 443, Seq: 2, Ack: 2, Len: 0
    Source Port: 14553
    Destination Port: 443
    [Stream index: 2]
    [Stream Packet Number: 3]
    [Conversation completeness: Incomplete (20)]
    [TCP Segment Len: 0]
    Sequence Number: 2    (relative sequence number)
    Sequence Number (raw): 3030388661
    [Next Sequence Number: 2    (relative sequence number)]
    Acknowledgment Number: 2    (relative ack number)
    Acknowledgment number (raw): 204321993
    0101 .... = Header Length: 20 bytes (5)
    Flags: 0x010 (ACK)
    Window: 255
    [Calculated window size: 255]
    [Window size scaling factor: -1 (unknown)]
    Checksum: 0x033d [unverified]
    [Checksum Status: Unverified]
    Urgent Pointer: 0
    [Timestamps]
    [SEQ/ACK analysis]

No.     Time           Source                Destination           Protocol Length Info
     13 0.060658       10.0.5.91             142.251.220.99        TCP      54     44668 → 443 [ACK] Seq=2 Ack=2 Win=255 Len=0

Frame 13: 54 bytes on wire (432 bits), 54 bytes captured (432 bits) on interface \Device\NPF_{84FAA220-1E48-4D46-9042-3D107EF88B2B}, id 0
Ethernet II, Src: Intel_df:95:53 (58:fb:84:df:95:53), Dst: Sophos_d1:43:e0 (7c:5a:1c:d1:43:e0)
Internet Protocol Version 4, Src: 10.0.5.91, Dst: 142.251.220.99
Transmission Control Protocol, Src Port: 44668, Dst Port: 443, Seq: 2, Ack: 2, Len: 0
    Source Port: 44668
    Destination Port: 443
    [Stream index: 1]
    [Stream Packet Number: 3]
    [Conversation completeness: Incomplete (20)]
    [TCP Segment Len: 0]
    Sequence Number: 2    (relative sequence number)
    Sequence Number (raw): 3844770764
    [Next Sequence Number: 2    (relative sequence number)]
    Acknowledgment Number: 2    (relative ack number)
    Acknowledgment number (raw): 1500391097
    0101 .... = Header Length: 20 bytes (5)
    Flags: 0x010 (ACK)
    Window: 255
    [Calculated window size: 255]
    [Window size scaling factor: -1 (unknown)]
    Checksum: 0x92c5 [unverified]
    [Checksum Status: Unverified]
    Urgent Pointer: 0
    [Timestamps]
    [SEQ/ACK analysis]

No.     Time           Source                Destination           Protocol Length Info
     14 0.310601       10.0.5.91             54.158.59.106         TCP      66     38791 → 443 [SYN] Seq=0 Win=64240 Len=0 MSS=1460 WS=256 SACK_PERM

Frame 14: 66 bytes on wire (528 bits), 66 bytes captured (528 bits) on interface \Device\NPF_{84FAA220-1E48-4D46-9042-3D107EF88B2B}, id 0
Ethernet II, Src: Intel_df:95:53 (58:fb:84:df:95:53), Dst: Sophos_d1:43:e0 (7c:5a:1c:d1:43:e0)
Internet Protocol Version 4, Src: 10.0.5.91, Dst: 54.158.59.106
Transmission Control Protocol, Src Port: 38791, Dst Port: 443, Seq: 0, Len: 0
    Source Port: 38791
    Destination Port: 443
    [Stream index: 4]
    [Stream Packet Number: 1]
    [Conversation completeness: Complete, WITH_DATA (31)]
    [TCP Segment Len: 0]
    Sequence Number: 0    (relative sequence number)
    Sequence Number (raw): 3743072404
    [Next Sequence Number: 1    (relative sequence number)]
    Acknowledgment Number: 0
    Acknowledgment number (raw): 0
    1000 .... = Header Length: 32 bytes (8)
    Flags: 0x002 (SYN)
    Window: 64240
    [Calculated window size: 64240]
    Checksum: 0xb9ca [unverified]
    [Checksum Status: Unverified]
    Urgent Pointer: 0
    Options: (12 bytes), Maximum segment size, No-Operation (NOP), Window scale, No-Operation (NOP), No-Operation (NOP), SACK permitted
    [Timestamps]

No.     Time           Source                Destination           Protocol Length Info
     15 0.312227       54.158.59.106         10.0.5.91             TCP      66     443 → 9835 [SYN, ACK] Seq=0 Ack=1 Win=26883 Len=0 MSS=1460 SACK_PERM WS=256

Frame 15: 66 bytes on wire (528 bits), 66 bytes captured (528 bits) on interface \Device\NPF_{84FAA220-1E48-4D46-9042-3D107EF88B2B}, id 0
Ethernet II, Src: Sophos_d1:43:e0 (7c:5a:1c:d1:43:e0), Dst: Intel_df:95:53 (58:fb:84:df:95:53)
Internet Protocol Version 4, Src: 54.158.59.106, Dst: 10.0.5.91
Transmission Control Protocol, Src Port: 443, Dst Port: 9835, Seq: 0, Ack: 1, Len: 0
    Source Port: 443
    Destination Port: 9835
    [Stream index: 3]
    [Stream Packet Number: 2]
    [Conversation completeness: Complete, WITH_DATA (31)]
    [TCP Segment Len: 0]
    Sequence Number: 0    (relative sequence number)
    Sequence Number (raw): 2883493432
    [Next Sequence Number: 1    (relative sequence number)]
    Acknowledgment Number: 1    (relative ack number)
    Acknowledgment number (raw): 3500902262
    1000 .... = Header Length: 32 bytes (8)
    Flags: 0x012 (SYN, ACK)
    Window: 26883
    [Calculated window size: 26883]
    Checksum: 0xba3a [unverified]
    [Checksum Status: Unverified]
    Urgent Pointer: 0
    Options: (12 bytes), Maximum segment size, No-Operation (NOP), No-Operation (NOP), SACK permitted, No-Operation (NOP), Window scale
    [Timestamps]
    [SEQ/ACK analysis]

No.     Time           Source                Destination           Protocol Length Info
     16 0.312414       10.0.5.91             54.158.59.106         TCP      54     9835 → 443 [ACK] Seq=1 Ack=1 Win=65536 Len=0

Frame 16: 54 bytes on wire (432 bits), 54 bytes captured (432 bits) on interface \Device\NPF_{84FAA220-1E48-4D46-9042-3D107EF88B2B}, id 0
Ethernet II, Src: Intel_df:95:53 (58:fb:84:df:95:53), Dst: Sophos_d1:43:e0 (7c:5a:1c:d1:43:e0)
Internet Protocol Version 4, Src: 10.0.5.91, Dst: 54.158.59.106
Transmission Control Protocol, Src Port: 9835, Dst Port: 443, Seq: 1, Ack: 1, Len: 0
    Source Port: 9835
    Destination Port: 443
    [Stream index: 3]
    [Stream Packet Number: 3]
    [Conversation completeness: Complete, WITH_DATA (31)]
    [TCP Segment Len: 0]
    Sequence Number: 1    (relative sequence number)
    Sequence Number (raw): 3500902262
    [Next Sequence Number: 1    (relative sequence number)]
    Acknowledgment Number: 1    (relative ack number)
    Acknowledgment number (raw): 2883493433
    0101 .... = Header Length: 20 bytes (5)
    Flags: 0x010 (ACK)
    Window: 256
    [Calculated window size: 65536]
    [Window size scaling factor: 256]
    Checksum: 0x6311 [unverified]
    [Checksum Status: Unverified]
    Urgent Pointer: 0
    [Timestamps]
    [SEQ/ACK analysis]

No.     Time           Source                Destination           Protocol Length Info
     17 0.315390       10.0.5.91             54.158.59.106         TCP      1514   9835 → 443 [ACK] Seq=1 Ack=1 Win=65536 Len=1460 [TCP PDU reassembled in 18]

Frame 17: 1514 bytes on wire (12112 bits), 1514 bytes captured (12112 bits) on interface \Device\NPF_{84FAA220-1E48-4D46-9042-3D107EF88B2B}, id 0
Ethernet II, Src: Intel_df:95:53 (58:fb:84:df:95:53), Dst: Sophos_d1:43:e0 (7c:5a:1c:d1:43:e0)
Internet Protocol Version 4, Src: 10.0.5.91, Dst: 54.158.59.106
Transmission Control Protocol, Src Port: 9835, Dst Port: 443, Seq: 1, Ack: 1, Len: 1460
    Source Port: 9835
    Destination Port: 443
    [Stream index: 3]
    [Stream Packet Number: 4]
    [Conversation completeness: Complete, WITH_DATA (31)]
    [TCP Segment Len: 1460]
    Sequence Number: 1    (relative sequence number)
    Sequence Number (raw): 3500902262
    [Next Sequence Number: 1461    (relative sequence number)]
    Acknowledgment Number: 1    (relative ack number)
    Acknowledgment number (raw): 2883493433
    0101 .... = Header Length: 20 bytes (5)
    Flags: 0x010 (ACK)
    Window: 256
    [Calculated window size: 65536]
    [Window size scaling factor: 256]
    Checksum: 0xa9a6 [unverified]
    [Checksum Status: Unverified]
    Urgent Pointer: 0
    [Timestamps]
    [SEQ/ACK analysis]
    TCP payload (1460 bytes)
    [Reassembled PDU in frame: 18]
    TCP segment data (1460 bytes)

No.     Time           Source                Destination           Protocol Length Info
     18 0.315390       10.0.5.91             54.158.59.106         TLSv1.2  506    Client Hello (SNI=extension.femetrics.grammarly.io)

Frame 18: 506 bytes on wire (4048 bits), 506 bytes captured (4048 bits) on interface \Device\NPF_{84FAA220-1E48-4D46-9042-3D107EF88B2B}, id 0
Ethernet II, Src: Intel_df:95:53 (58:fb:84:df:95:53), Dst: Sophos_d1:43:e0 (7c:5a:1c:d1:43:e0)
Internet Protocol Version 4, Src: 10.0.5.91, Dst: 54.158.59.106
Transmission Control Protocol, Src Port: 9835, Dst Port: 443, Seq: 1461, Ack: 1, Len: 452
    Source Port: 9835
    Destination Port: 443
    [Stream index: 3]
    [Stream Packet Number: 5]
    [Conversation completeness: Complete, WITH_DATA (31)]
    [TCP Segment Len: 452]
    Sequence Number: 1461    (relative sequence number)
    Sequence Number (raw): 3500903722
    [Next Sequence Number: 1913    (relative sequence number)]
    Acknowledgment Number: 1    (relative ack number)
    Acknowledgment number (raw): 2883493433
    0101 .... = Header Length: 20 bytes (5)
    Flags: 0x018 (PSH, ACK)
    Window: 256
    [Calculated window size: 65536]
    [Window size scaling factor: 256]
    Checksum: 0xfb61 [unverified]
    [Checksum Status: Unverified]
    Urgent Pointer: 0
    [Timestamps]
    [SEQ/ACK analysis]
    TCP payload (452 bytes)
    TCP segment data (452 bytes)
[2 Reassembled TCP Segments (1912 bytes): #17(1460), #18(452)]
Transport Layer Security

No.     Time           Source                Destination           Protocol Length Info
     19 0.671378       10.0.5.91             1.1.1.1               DNS      98     Standard query 0x02b9 A inputsuggestions.msdxcdn.microsoft.com

Frame 19: 98 bytes on wire (784 bits), 98 bytes captured (784 bits) on interface \Device\NPF_{84FAA220-1E48-4D46-9042-3D107EF88B2B}, id 0
Ethernet II, Src: Intel_df:95:53 (58:fb:84:df:95:53), Dst: Sophos_d1:43:e0 (7c:5a:1c:d1:43:e0)
Internet Protocol Version 4, Src: 10.0.5.91, Dst: 1.1.1.1
User Datagram Protocol, Src Port: 57827, Dst Port: 53
Domain Name System (query)

No.     Time           Source                Destination           Protocol Length Info
     20 0.675544       54.158.59.106         10.0.5.91             TLSv1.2  1514   Server Hello

Frame 20: 1514 bytes on wire (12112 bits), 1514 bytes captured (12112 bits) on interface \Device\NPF_{84FAA220-1E48-4D46-9042-3D107EF88B2B}, id 0
Ethernet II, Src: Sophos_d1:43:e0 (7c:5a:1c:d1:43:e0), Dst: Intel_df:95:53 (58:fb:84:df:95:53)
Internet Protocol Version 4, Src: 54.158.59.106, Dst: 10.0.5.91
Transmission Control Protocol, Src Port: 443, Dst Port: 9835, Seq: 1, Ack: 1913, Len: 1460
    Source Port: 443
    Destination Port: 9835
    [Stream index: 3]
    [Stream Packet Number: 6]
    [Conversation completeness: Complete, WITH_DATA (31)]
    [TCP Segment Len: 1460]
    Sequence Number: 1    (relative sequence number)
    Sequence Number (raw): 2883493433
    [Next Sequence Number: 1461    (relative sequence number)]
    Acknowledgment Number: 1913    (relative ack number)
    Acknowledgment number (raw): 3500904174
    0101 .... = Header Length: 20 bytes (5)
    Flags: 0x010 (ACK)
    Window: 176
    [Calculated window size: 45056]
    [Window size scaling factor: 256]
    Checksum: 0x880b [unverified]
    [Checksum Status: Unverified]
    Urgent Pointer: 0
    [Timestamps]
    [SEQ/ACK analysis]
    TCP payload (1460 bytes)
    [Reassembled PDU in frame: 23]
    TCP segment data (1347 bytes)
Transport Layer Security

No.     Time           Source                Destination           Protocol Length Info
     21 0.675544       54.158.59.106         10.0.5.91             TCP      1514   443 → 9835 [ACK] Seq=1461 Ack=1913 Win=45056 Len=1460 [TCP PDU reassembled in 23]

Frame 21: 1514 bytes on wire (12112 bits), 1514 bytes captured (12112 bits) on interface \Device\NPF_{84FAA220-1E48-4D46-9042-3D107EF88B2B}, id 0
Ethernet II, Src: Sophos_d1:43:e0 (7c:5a:1c:d1:43:e0), Dst: Intel_df:95:53 (58:fb:84:df:95:53)
Internet Protocol Version 4, Src: 54.158.59.106, Dst: 10.0.5.91
Transmission Control Protocol, Src Port: 443, Dst Port: 9835, Seq: 1461, Ack: 1913, Len: 1460
    Source Port: 443
    Destination Port: 9835
    [Stream index: 3]
    [Stream Packet Number: 7]
    [Conversation completeness: Complete, WITH_DATA (31)]
    [TCP Segment Len: 1460]
    Sequence Number: 1461    (relative sequence number)
    Sequence Number (raw): 2883494893
    [Next Sequence Number: 2921    (relative sequence number)]
    Acknowledgment Number: 1913    (relative ack number)
    Acknowledgment number (raw): 3500904174
    0101 .... = Header Length: 20 bytes (5)
    Flags: 0x010 (ACK)
    Window: 176
    [Calculated window size: 45056]
    [Window size scaling factor: 256]
    Checksum: 0x60cc [unverified]
    [Checksum Status: Unverified]
    Urgent Pointer: 0
    [Timestamps]
    [SEQ/ACK analysis]
    TCP payload (1460 bytes)
    [Reassembled PDU in frame: 23]
    TCP segment data (1460 bytes)

No.     Time           Source                Destination           Protocol Length Info
     22 0.675765       10.0.5.91             54.158.59.106         TCP      54     9835 → 443 [ACK] Seq=1913 Ack=2921 Win=65536 Len=0

Frame 22: 54 bytes on wire (432 bits), 54 bytes captured (432 bits) on interface \Device\NPF_{84FAA220-1E48-4D46-9042-3D107EF88B2B}, id 0
Ethernet II, Src: Intel_df:95:53 (58:fb:84:df:95:53), Dst: Sophos_d1:43:e0 (7c:5a:1c:d1:43:e0)
Internet Protocol Version 4, Src: 10.0.5.91, Dst: 54.158.59.106
Transmission Control Protocol, Src Port: 9835, Dst Port: 443, Seq: 1913, Ack: 2921, Len: 0
    Source Port: 9835
    Destination Port: 443
    [Stream index: 3]
    [Stream Packet Number: 8]
    [Conversation completeness: Complete, WITH_DATA (31)]
    [TCP Segment Len: 0]
    Sequence Number: 1913    (relative sequence number)
    Sequence Number (raw): 3500904174
    [Next Sequence Number: 1913    (relative sequence number)]
    Acknowledgment Number: 2921    (relative ack number)
    Acknowledgment number (raw): 2883496353
    0101 .... = Header Length: 20 bytes (5)
    Flags: 0x010 (ACK)
    Window: 256
    [Calculated window size: 65536]
    [Window size scaling factor: 256]
    Checksum: 0x5031 [unverified]
    [Checksum Status: Unverified]
    Urgent Pointer: 0
    [Timestamps]
    [SEQ/ACK analysis]

No.     Time           Source                Destination           Protocol Length Info
     23 0.676263       54.158.59.106         10.0.5.91             TLSv1.2  1431   Certificate, Server Key Exchange, Server Hello Done

Frame 23: 1431 bytes on wire (11448 bits), 1431 bytes captured (11448 bits) on interface \Device\NPF_{84FAA220-1E48-4D46-9042-3D107EF88B2B}, id 0
Ethernet II, Src: Sophos_d1:43:e0 (7c:5a:1c:d1:43:e0), Dst: Intel_df:95:53 (58:fb:84:df:95:53)
Internet Protocol Version 4, Src: 54.158.59.106, Dst: 10.0.5.91
Transmission Control Protocol, Src Port: 443, Dst Port: 9835, Seq: 2921, Ack: 1913, Len: 1377
    Source Port: 443
    Destination Port: 9835
    [Stream index: 3]
    [Stream Packet Number: 9]
    [Conversation completeness: Complete, WITH_DATA (31)]
    [TCP Segment Len: 1377]
    Sequence Number: 2921    (relative sequence number)
    Sequence Number (raw): 2883496353
    [Next Sequence Number: 4298    (relative sequence number)]
    Acknowledgment Number: 1913    (relative ack number)
    Acknowledgment number (raw): 3500904174
    0101 .... = Header Length: 20 bytes (5)
    Flags: 0x018 (PSH, ACK)
    Window: 176
    [Calculated window size: 45056]
    [Window size scaling factor: 256]
    Checksum: 0x819a [unverified]
    [Checksum Status: Unverified]
    Urgent Pointer: 0
    [Timestamps]
    [SEQ/ACK analysis]
    TCP payload (1377 bytes)
    TCP segment data (1030 bytes)
[3 Reassembled TCP Segments (3837 bytes): #20(1347), #21(1460), #23(1030)]
Transport Layer Security
Transport Layer Security

No.     Time           Source                Destination           Protocol Length Info
     24 0.676263       54.158.59.106         10.0.5.91             TCP      66     443 → 38791 [SYN, ACK] Seq=0 Ack=1 Win=26883 Len=0 MSS=1460 SACK_PERM WS=256

Frame 24: 66 bytes on wire (528 bits), 66 bytes captured (528 bits) on interface \Device\NPF_{84FAA220-1E48-4D46-9042-3D107EF88B2B}, id 0
Ethernet II, Src: Sophos_d1:43:e0 (7c:5a:1c:d1:43:e0), Dst: Intel_df:95:53 (58:fb:84:df:95:53)
Internet Protocol Version 4, Src: 54.158.59.106, Dst: 10.0.5.91
Transmission Control Protocol, Src Port: 443, Dst Port: 38791, Seq: 0, Ack: 1, Len: 0
    Source Port: 443
    Destination Port: 38791
    [Stream index: 4]
    [Stream Packet Number: 2]
    [Conversation completeness: Complete, WITH_DATA (31)]
    [TCP Segment Len: 0]
    Sequence Number: 0    (relative sequence number)
    Sequence Number (raw): 3995884030
    [Next Sequence Number: 1    (relative sequence number)]
    Acknowledgment Number: 1    (relative ack number)
    Acknowledgment number (raw): 3743072405
    1000 .... = Header Length: 32 bytes (8)
    Flags: 0x012 (SYN, ACK)
    Window: 26883
    [Calculated window size: 26883]
    Checksum: 0x037c [unverified]
    [Checksum Status: Unverified]
    Urgent Pointer: 0
    Options: (12 bytes), Maximum segment size, No-Operation (NOP), No-Operation (NOP), SACK permitted, No-Operation (NOP), Window scale
    [Timestamps]
    [SEQ/ACK analysis]

No.     Time           Source                Destination           Protocol Length Info
     25 0.676600       10.0.5.91             54.158.59.106         TCP      54     38791 → 443 [ACK] Seq=1 Ack=1 Win=65536 Len=0

Frame 25: 54 bytes on wire (432 bits), 54 bytes captured (432 bits) on interface \Device\NPF_{84FAA220-1E48-4D46-9042-3D107EF88B2B}, id 0
Ethernet II, Src: Intel_df:95:53 (58:fb:84:df:95:53), Dst: Sophos_d1:43:e0 (7c:5a:1c:d1:43:e0)
Internet Protocol Version 4, Src: 10.0.5.91, Dst: 54.158.59.106
Transmission Control Protocol, Src Port: 38791, Dst Port: 443, Seq: 1, Ack: 1, Len: 0
    Source Port: 38791
    Destination Port: 443
    [Stream index: 4]
    [Stream Packet Number: 3]
    [Conversation completeness: Complete, WITH_DATA (31)]
    [TCP Segment Len: 0]
    Sequence Number: 1    (relative sequence number)
    Sequence Number (raw): 3743072405
    [Next Sequence Number: 1    (relative sequence number)]
    Acknowledgment Number: 1    (relative ack number)
    Acknowledgment number (raw): 3995884031
    0101 .... = Header Length: 20 bytes (5)
    Flags: 0x010 (ACK)
    Window: 256
    [Calculated window size: 65536]
    [Window size scaling factor: 256]
    Checksum: 0xac52 [unverified]
    [Checksum Status: Unverified]
    Urgent Pointer: 0
    [Timestamps]
    [SEQ/ACK analysis]

No.     Time           Source                Destination           Protocol Length Info
     26 0.678705       10.0.5.91             54.158.59.106         TLSv1.2  180    Client Key Exchange, Change Cipher Spec, Encrypted Handshake Message

Frame 26: 180 bytes on wire (1440 bits), 180 bytes captured (1440 bits) on interface \Device\NPF_{84FAA220-1E48-4D46-9042-3D107EF88B2B}, id 0
Ethernet II, Src: Intel_df:95:53 (58:fb:84:df:95:53), Dst: Sophos_d1:43:e0 (7c:5a:1c:d1:43:e0)
Internet Protocol Version 4, Src: 10.0.5.91, Dst: 54.158.59.106
Transmission Control Protocol, Src Port: 9835, Dst Port: 443, Seq: 1913, Ack: 4298, Len: 126
    Source Port: 9835
    Destination Port: 443
    [Stream index: 3]
    [Stream Packet Number: 10]
    [Conversation completeness: Complete, WITH_DATA (31)]
    [TCP Segment Len: 126]
    Sequence Number: 1913    (relative sequence number)
    Sequence Number (raw): 3500904174
    [Next Sequence Number: 2039    (relative sequence number)]
    Acknowledgment Number: 4298    (relative ack number)
    Acknowledgment number (raw): 2883497730
    0101 .... = Header Length: 20 bytes (5)
    Flags: 0x018 (PSH, ACK)
    Window: 251
    [Calculated window size: 64256]
    [Window size scaling factor: 256]
    Checksum: 0xdb66 [unverified]
    [Checksum Status: Unverified]
    Urgent Pointer: 0
    [Timestamps]
    [SEQ/ACK analysis]
    TCP payload (126 bytes)
Transport Layer Security

No.     Time           Source                Destination           Protocol Length Info
     27 0.680674       10.0.5.91             54.158.59.106         TCP      1514   38791 → 443 [ACK] Seq=1 Ack=1 Win=65536 Len=1460 [TCP PDU reassembled in 28]

Frame 27: 1514 bytes on wire (12112 bits), 1514 bytes captured (12112 bits) on interface \Device\NPF_{84FAA220-1E48-4D46-9042-3D107EF88B2B}, id 0
Ethernet II, Src: Intel_df:95:53 (58:fb:84:df:95:53), Dst: Sophos_d1:43:e0 (7c:5a:1c:d1:43:e0)
Internet Protocol Version 4, Src: 10.0.5.91, Dst: 54.158.59.106
Transmission Control Protocol, Src Port: 38791, Dst Port: 443, Seq: 1, Ack: 1, Len: 1460
    Source Port: 38791
    Destination Port: 443
    [Stream index: 4]
    [Stream Packet Number: 4]
    [Conversation completeness: Complete, WITH_DATA (31)]
    [TCP Segment Len: 1460]
    Sequence Number: 1    (relative sequence number)
    Sequence Number (raw): 3743072405
    [Next Sequence Number: 1461    (relative sequence number)]
    Acknowledgment Number: 1    (relative ack number)
    Acknowledgment number (raw): 3995884031
    0101 .... = Header Length: 20 bytes (5)
    Flags: 0x010 (ACK)
    Window: 256
    [Calculated window size: 65536]
    [Window size scaling factor: 256]
    Checksum: 0x3566 [unverified]
    [Checksum Status: Unverified]
    Urgent Pointer: 0
    [Timestamps]
    [SEQ/ACK analysis]
    TCP payload (1460 bytes)
    [Reassembled PDU in frame: 28]
    TCP segment data (1460 bytes)

No.     Time           Source                Destination           Protocol Length Info
     28 0.680674       10.0.5.91             54.158.59.106         TLSv1.2  474    Client Hello (SNI=extension.femetrics.grammarly.io)

Frame 28: 474 bytes on wire (3792 bits), 474 bytes captured (3792 bits) on interface \Device\NPF_{84FAA220-1E48-4D46-9042-3D107EF88B2B}, id 0
Ethernet II, Src: Intel_df:95:53 (58:fb:84:df:95:53), Dst: Sophos_d1:43:e0 (7c:5a:1c:d1:43:e0)
Internet Protocol Version 4, Src: 10.0.5.91, Dst: 54.158.59.106
Transmission Control Protocol, Src Port: 38791, Dst Port: 443, Seq: 1461, Ack: 1, Len: 420
    Source Port: 38791
    Destination Port: 443
    [Stream index: 4]
    [Stream Packet Number: 5]
    [Conversation completeness: Complete, WITH_DATA (31)]
    [TCP Segment Len: 420]
    Sequence Number: 1461    (relative sequence number)
    Sequence Number (raw): 3743073865
    [Next Sequence Number: 1881    (relative sequence number)]
    Acknowledgment Number: 1    (relative ack number)
    Acknowledgment number (raw): 3995884031
    0101 .... = Header Length: 20 bytes (5)
    Flags: 0x018 (PSH, ACK)
    Window: 256
    [Calculated window size: 65536]
    [Window size scaling factor: 256]
    Checksum: 0x4609 [unverified]
    [Checksum Status: Unverified]
    Urgent Pointer: 0
    [Timestamps]
    [SEQ/ACK analysis]
    TCP payload (420 bytes)
    TCP segment data (420 bytes)
[2 Reassembled TCP Segments (1880 bytes): #27(1460), #28(420)]
Transport Layer Security

No.     Time           Source                Destination           Protocol Length Info
     29 0.681326       10.0.5.91             54.158.59.106         TLSv1.2  153    Application Data

Frame 29: 153 bytes on wire (1224 bits), 153 bytes captured (1224 bits) on interface \Device\NPF_{84FAA220-1E48-4D46-9042-3D107EF88B2B}, id 0
Ethernet II, Src: Intel_df:95:53 (58:fb:84:df:95:53), Dst: Sophos_d1:43:e0 (7c:5a:1c:d1:43:e0)
Internet Protocol Version 4, Src: 10.0.5.91, Dst: 54.158.59.106
Transmission Control Protocol, Src Port: 9835, Dst Port: 443, Seq: 2039, Ack: 4298, Len: 99
    Source Port: 9835
    Destination Port: 443
    [Stream index: 3]
    [Stream Packet Number: 11]
    [Conversation completeness: Complete, WITH_DATA (31)]
    [TCP Segment Len: 99]
    Sequence Number: 2039    (relative sequence number)
    Sequence Number (raw): 3500904300
    [Next Sequence Number: 2138    (relative sequence number)]
    Acknowledgment Number: 4298    (relative ack number)
    Acknowledgment number (raw): 2883497730
    0101 .... = Header Length: 20 bytes (5)
    Flags: 0x018 (PSH, ACK)
    Window: 251
    [Calculated window size: 64256]
    [Window size scaling factor: 256]
    Checksum: 0xc9f0 [unverified]
    [Checksum Status: Unverified]
    Urgent Pointer: 0
    [Timestamps]
    [SEQ/ACK analysis]
    TCP payload (99 bytes)
Transport Layer Security

No.     Time           Source                Destination           Protocol Length Info
     30 0.682187       10.0.5.91             54.158.59.106         TLSv1.2  416    Application Data

Frame 30: 416 bytes on wire (3328 bits), 416 bytes captured (3328 bits) on interface \Device\NPF_{84FAA220-1E48-4D46-9042-3D107EF88B2B}, id 0
Ethernet II, Src: Intel_df:95:53 (58:fb:84:df:95:53), Dst: Sophos_d1:43:e0 (7c:5a:1c:d1:43:e0)
Internet Protocol Version 4, Src: 10.0.5.91, Dst: 54.158.59.106
Transmission Control Protocol, Src Port: 9835, Dst Port: 443, Seq: 2138, Ack: 4298, Len: 362
    Source Port: 9835
    Destination Port: 443
    [Stream index: 3]
    [Stream Packet Number: 12]
    [Conversation completeness: Complete, WITH_DATA (31)]
    [TCP Segment Len: 362]
    Sequence Number: 2138    (relative sequence number)
    Sequence Number (raw): 3500904399
    [Next Sequence Number: 2500    (relative sequence number)]
    Acknowledgment Number: 4298    (relative ack number)
    Acknowledgment number (raw): 2883497730
    0101 .... = Header Length: 20 bytes (5)
    Flags: 0x018 (PSH, ACK)
    Window: 251
    [Calculated window size: 64256]
    [Window size scaling factor: 256]
    Checksum: 0x6179 [unverified]
    [Checksum Status: Unverified]
    Urgent Pointer: 0
    [Timestamps]
    [SEQ/ACK analysis]
    TCP payload (362 bytes)
Transport Layer Security

No.     Time           Source                Destination           Protocol Length Info
     31 0.682409       10.0.5.91             54.158.59.106         TCP      1514   9835 → 443 [ACK] Seq=2500 Ack=4298 Win=64256 Len=1460 [TCP PDU reassembled in 32]

Frame 31: 1514 bytes on wire (12112 bits), 1514 bytes captured (12112 bits) on interface \Device\NPF_{84FAA220-1E48-4D46-9042-3D107EF88B2B}, id 0
Ethernet II, Src: Intel_df:95:53 (58:fb:84:df:95:53), Dst: Sophos_d1:43:e0 (7c:5a:1c:d1:43:e0)
Internet Protocol Version 4, Src: 10.0.5.91, Dst: 54.158.59.106
Transmission Control Protocol, Src Port: 9835, Dst Port: 443, Seq: 2500, Ack: 4298, Len: 1460
    Source Port: 9835
    Destination Port: 443
    [Stream index: 3]
    [Stream Packet Number: 13]
    [Conversation completeness: Complete, WITH_DATA (31)]
    [TCP Segment Len: 1460]
    Sequence Number: 2500    (relative sequence number)
